id,conversation_id,created_at,date,time,timezone,user_id,username,name,place,tweet,mentions,urls,photos,replies_count,retweets_count,likes_count,hashtags,cashtags,link,retweet,quote_url,video,near,geo,source,user_rt_id,user_rt,retweet_id,reply_to,retweet_date,translate,trans_src,trans_dest
1247569805705728003,1247569805705728003,1586278795000,2020-04-07,23:59:55,+07,705465675884707840,trevorrosenfels,Trevor Rosenfels,,"I tried to google COVID-19 Deaths Per Day in the U.S. & by State, because this would provide a clear view of how we are doing against the virus. Guess what? I got a lot of sensationalism & lot's of cumulative deaths & cumulative cases. Propaganda being peddled by MSM.",[],[],[],0,0,0,[],[],https://twitter.com/TrevorRosenfels/status/1247569805705728003,False,,0,,,,,,,"[{'user_id': '705465675884707840', 'username': 'TrevorRosenfels'}]",,,,
1247569804795445248,1247569804795445248,1586278794000,2020-04-07,23:59:54,+07,1511491182,mixyezpitlek,JDA:NEWS:STUFF ꝏ #FreeNazanin #FBPE,,"“Italy records 604 new Covid-19 deaths

Angela Giuffrida

Deaths from coronavirus in Italy rose by 604 on Tuesday, although the country marked the lowest day-to-day increase in new infections since it was quarantined, Angela Giuffrida reports.
New cas…”  https://gu.com/p/dtpx2/stw ",[],['https://gu.com/p/dtpx2/stw'],[],0,1,1,[],[],https://twitter.com/Mixyezpitlek/status/1247569804795445248,False,,0,,,,,,,"[{'user_id': '1511491182', 'username': 'Mixyezpitlek'}]",,,,
1247569804187197441,1247569804187197441,1586278794000,2020-04-07,23:59:54,+07,942240917771059200,haolethai,LE THAI HAO,,Four new cases take Vietnam’s Covid-19 count to 249  https://bit.ly/2JOekJq ,[],['https://bit.ly/2JOekJq'],[],0,1,0,[],[],https://twitter.com/HaoleThai/status/1247569804187197441,False,,0,,,,,,,"[{'user_id': '942240917771059200', 'username': 'HaoleThai'}]",,,,
1247569803457572864,1247279994126073860,1586278794000,2020-04-07,23:59:54,+07,837489794150248449,37mediagroup,37mediagroup,,"""People with CoVid will be able to use the ship""  pic.twitter.com/qYIRhfjKuu",['atrupar'],[],[],0,0,0,[],[],https://twitter.com/37mediagroup/status/1247569803457572864,False,,1,,,,,,,"[{'user_id': '837489794150248449', 'username': '37mediagroup'}, {'user_id': '288277167', 'username': 'atrupar'}]",,,,
1247569803222618118,1247546997072109573,1586278794000,2020-04-07,23:59:54,+07,1619862739,nordic_man,Nordic Gentleman🇫🇮✝️ 🏳️‍🌈⃠ ‏,,"“The CDC issued an alert stating that doctors should classify ‘probable COVID-19’ or ‘likely COVID-19’ as Covid-19 deaths. Perhaps that explains the seeming drop-off of pneumonia deaths this year and the simultaneous spike in Covid-19 deaths.”

 http://ronpaulinstitute.org/archives/featured-articles/2020/april/06/end-the-shutdown-it-s-time-for-resurrection/ …",['herr_meenzer'],['http://ronpaulinstitute.org/archives/featured-articles/2020/april/06/end-the-shutdown-it-s-time-for-resurrection/'],[],3,0,0,[],[],https://twitter.com/Nordic_Man/status/1247569803222618118,False,,0,,,,,,,"[{'user_id': '1619862739', 'username': 'Nordic_Man'}, {'user_id': '760937880088932352', 'username': 'Herr_Meenzer'}]",,,,
1247569802631286784,1247569802631286784,1586278794000,2020-04-07,23:59:54,+07,295680740,fwjlegal,FWJLegal,,"What is the best way to recover debts during COVID-19? @AndrewFWJLegal explains the many benefits of using online mediation:  https://bit.ly/3ecZSIW 
#alternativedisputeresolution #covid19 #coronavirus #negotiation #debts #remotemediation #ADR #debt #litigationalternative pic.twitter.com/w4jDNA82kN",['andrewfwjlegal'],['https://bit.ly/3ecZSIW'],['https://pbs.twimg.com/media/EVBCEb0XYAQb9r9.jpg'],0,0,0,"['#alternativedisputeresolution', '#covid19', '#coronavirus', '#negotiation', '#debts', '#remotemediation', '#adr', '#debt', '#litigationalternative']",[],https://twitter.com/FWJLEGAL/status/1247569802631286784,False,,0,,,,,,,"[{'user_id': '295680740', 'username': 'FWJLEGAL'}, {'user_id': '3091774852', 'username': 'AndrewFWJLegal'}]",,,,
1247569801788166146,1247569801788166146,1586278794000,2020-04-07,23:59:54,+07,2996374796,asheblitzen,Ashe Blitzen ✨,,"Coming atcha live from my personal COVID hell at work 😷😂😅

Please stay home if you can so I can live vicariously through you ❤️

Also pray for my sanity because it’s literally a circle of hell here lately.  pic.twitter.com/q3GoCSilvW",[],[],['https://pbs.twimg.com/media/EVBCHoPXkAg-mH1.jpg'],2,0,18,[],[],https://twitter.com/AsheBlitzen/status/1247569801788166146,False,,0,,,,,,,"[{'user_id': '2996374796', 'username': 'AsheBlitzen'}]",,,,
1247569800605372417,1247569800605372417,1586278793000,2020-04-07,23:59:53,+07,535820788,sduvall07,Scott Duvall,,New Democrats are deeply concerned about the lack of assistance being offered to Canadian seniors in the government’s response to the COVID-19 Pandemic.  pic.twitter.com/rmfD7csNP4,[],[],['https://pbs.twimg.com/media/EVBBmQFXYAASZxh.jpg'],0,1,6,[],[],https://twitter.com/sduvall07/status/1247569800605372417,False,,0,,,,,,,"[{'user_id': '535820788', 'username': 'sduvall07'}]",,,,
1247569800198586368,1247569800198586368,1586278793000,2020-04-07,23:59:53,+07,22678140,jamaicastar,Jamaica Star,,"Six Trelawny men charged for breaching COVID curfew
 https://bit.ly/3dXlvwJ ",[],['https://bit.ly/3dXlvwJ'],[],0,1,0,[],[],https://twitter.com/jamaicastar/status/1247569800198586368,False,,0,,,,,,,"[{'user_id': '22678140', 'username': 'jamaicastar'}]",,,,
1247569799447826434,1247569799447826434,1586278793000,2020-04-07,23:59:53,+07,74409745,bergren,Martha Bergren,,Seven tips to manage your mental health and well-being during the COVID-19 outbreak  https://www.nature.com/articles/d41586-020-00933-5 …,[],['https://www.nature.com/articles/d41586-020-00933-5'],[],0,1,0,[],[],https://twitter.com/bergren/status/1247569799447826434,False,,0,,,,,,,"[{'user_id': '74409745', 'username': 'bergren'}]",,,,
1247569799028203522,1247569799028203522,1586278793000,2020-04-07,23:59:53,+07,997135862545563648,morozkoforge,MorozkoForge,,"Since first publishing 'The Curve is Already Flat' by @AJKayWriter (w/ @seagertp) on 3 Apr, COVID narrative  has changed.  Despite the vitriolic criticism, and @Medium censorship, some politicians, scientists, and journalists are corroborating our report. https://www.morozkoforge.com/cold-water-immersion-science …","['ajkaywriter', 'seagertp', 'medium']",['https://www.morozkoforge.com/cold-water-immersion-science'],[],1,3,7,[],[],https://twitter.com/MorozkoForge/status/1247569799028203522,False,,0,,,,,,,"[{'user_id': '997135862545563648', 'username': 'MorozkoForge'}, {'user_id': '993268289227780096', 'username': 'AJKayWriter'}, {'user_id': '458615118', 'username': 'seagertp'}, {'user_id': '571202103', 'username': 'Medium'}]",,,,
1247569798789312514,1247569798789312514,1586278793000,2020-04-07,23:59:53,+07,1233141490886619154,digitalprproxy,DigitalPRproxy,,People First: Wikimedia’s Response to COVID-19 by @krmaher https://link.medium.com/BJPs6E5YS4 ,['krmaher'],['https://link.medium.com/BJPs6E5YS4'],[],0,0,6,[],[],https://twitter.com/DigitalPRproxy/status/1247569798789312514,False,,0,,,,,,,"[{'user_id': '1233141490886619154', 'username': 'DigitalPRproxy'}, {'user_id': '16434823', 'username': 'krmaher'}]",,,,
1247569798042656776,1247569798042656776,1586278793000,2020-04-07,23:59:53,+07,1454772757,sipuck73,Si🎯,,"Im willing to bet Boris has already had the clap.

#ClapForBoris #Nah
#ClapForTheNHS
#COVID19 #Covid #CoronaVirus",[],[],[],0,0,0,"['#clapforboris', '#nah', '#clapforthenhs', '#covid19', '#covid', '#coronavirus']",[],https://twitter.com/SiPuck73/status/1247569798042656776,False,,0,,,,,,,"[{'user_id': '1454772757', 'username': 'SiPuck73'}]",,,,
1247569797300097030,1247569797300097030,1586278793000,2020-04-07,23:59:53,+07,1210982567207260160,sweatequitycomx,Sweat Equity,,"GOP is a death cult. 

 Wisconsin moves ahead with election amid COVID-19 pandemic   https://twitter.com/i/events/1247527595928719360 …",[],['https://twitter.com/i/events/1247527595928719360'],[],0,0,0,[],[],https://twitter.com/sweatequitycomx/status/1247569797300097030,False,,0,,,,,,,"[{'user_id': '1210982567207260160', 'username': 'sweatequitycomx'}]",,,,
1247569796734091265,1247569796734091265,1586278792000,2020-04-07,23:59:52,+07,33052452,healthchickk,healthchick,,"If dieting & still feeling hungry after your meal a trick I like to use is to make a homemade latte (coffee or tea) or a soda stream bevie with citrus, also turning your focus to some work or reading. Perhaps this will help you. Happy not-trying-to-get-fat-during COVID :P",[],[],[],0,0,0,[],[],https://twitter.com/healthchickk/status/1247569796734091265,False,,0,,,,,,,"[{'user_id': '33052452', 'username': 'healthchickk'}]",,,,
1247569796113334272,1247569796113334272,1586278792000,2020-04-07,23:59:52,+07,2909746599,jonnyr_labour,JonnyRoberts~Labour,,"Just $537,280,000,000 to end global extreme poverty ($2 a day), with all these COVID-19 domestic stimulus measures worldwide, why we can’t find that sum for the worlds very poorest should be a question we ask every, single day  https://twitter.com/BBCr4today/status/1247431871803338753 …",[],['https://twitter.com/BBCr4today/status/1247431871803338753'],[],0,0,0,[],[],https://twitter.com/JonnyR_Labour/status/1247569796113334272,False,https://twitter.com/BBCr4today/status/1247431871803338753,0,,,,,,,"[{'user_id': '2909746599', 'username': 'JonnyR_Labour'}]",,,,
1247569796016685057,1247569796016685057,1586278792000,2020-04-07,23:59:52,+07,864744183063470080,limehotcheetos,Brenda M 🍯🐝,,Seeing POC being racist towards the Asian community due to Covid-19 is so disgusting. When they know first hand how it feels to be judged for where you're from or the color of your skin.,[],[],[],0,0,3,[],[],https://twitter.com/limehotcheetos/status/1247569796016685057,False,,0,,,,,,,"[{'user_id': '864744183063470080', 'username': 'limehotcheetos'}]",,,,
1247569795018625026,1247569260475539466,1586278792000,2020-04-07,23:59:52,+07,1069674516664778759,bigbarabelly,BBB coms open!,,"If you like my art and want to support me during the nightmare that is covid  http://ko-fi.com/barabeasts  !
My husbands job got axed and freelancing is all I have",[],['http://ko-fi.com/barabeasts'],[],0,0,0,[],[],https://twitter.com/bigbarabelly/status/1247569795018625026,False,,0,,,,,,,"[{'user_id': '1069674516664778759', 'username': 'bigbarabelly'}]",,,,
1247569794070708225,1247569794070708225,1586278792000,2020-04-07,23:59:52,+07,957259626,cmdanigeria,"Christian Medical and Dental Association, Nigeria",,COVID-19 Response Prayers – Day 2  https://cmdanigeria.org/covid-19-response-prayers-day-2/ … pic.twitter.com/4UvN0bqN8p,[],['https://cmdanigeria.org/covid-19-response-prayers-day-2/'],['https://pbs.twimg.com/media/EVBCHbvWsAAZb3d.jpg'],0,6,20,[],[],https://twitter.com/cmdanigeria/status/1247569794070708225,False,,0,,,,,,,"[{'user_id': '957259626', 'username': 'cmdanigeria'}]",,,,
1247569794032795653,1247569794032795653,1586278792000,2020-04-07,23:59:52,+07,862880158780346368,peggygilmour173,Peggy Gilmour,,"HUGE! Covid Tracking Website DELETES Information on Hospitalizations, ICU Patients After TGP Reports Numbers Fall Well Below Model Predictions  https://www.thegatewaypundit.com/2020/04/huge-covid-tracking-website-deletes-information-hospitalizations-icu-patients-tgp-reports-numbers-fall-bogus-model-predictions/?utm_source=Twitter&utm_medium=PostBottomSharingButtons&utm_campaign=websitesharingbuttons …",[],['https://www.thegatewaypundit.com/2020/04/huge-covid-tracking-website-deletes-information-hospitalizations-icu-patients-tgp-reports-numbers-fall-bogus-model-predictions/?utm_source=Twitter&utm_medium=PostBottomSharingButtons&utm_campaign=websitesharingbuttons'],[],0,1,1,[],[],https://twitter.com/peggygilmour173/status/1247569794032795653,False,,0,,,,,,,"[{'user_id': '862880158780346368', 'username': 'peggygilmour173'}]",,,,
1247569793370279940,1247569793370279940,1586278792000,2020-04-07,23:59:52,+07,98456136,leolionmark,🎬🎥Mark Anthony📺📷,,Estimates for the relative impact of different COVID-19 control measures in the UK. https://www.lshtm.ac.uk/newsevents/news/2020/estimates-relative-impact-different-covid-19-control-measures-uk …,[],['https://www.lshtm.ac.uk/newsevents/news/2020/estimates-relative-impact-different-covid-19-control-measures-uk'],[],0,0,0,[],[],https://twitter.com/leolionmark/status/1247569793370279940,False,,0,,,,,,,"[{'user_id': '98456136', 'username': 'leolionmark'}]",,,,
1247569793328148480,1246442807394553856,1586278792000,2020-04-07,23:59:52,+07,1488312234,cassidyts,❄️ ⛸ CASS!!! ON ICE ⛸ ❄️,,"$CassMart1 
PLEAE NOTICE ME!!! I was laid off due to covid-19 and after paying all my bills I have no money for groceries so if you could please help!! It would be so appreciated!!",['fredtjoseph'],[],[],0,0,0,[],[],https://twitter.com/CassidyTs/status/1247569793328148480,False,,0,,,,,,,"[{'user_id': '1488312234', 'username': 'CassidyTs'}, {'user_id': '2729784259', 'username': 'FredTJoseph'}]",,,,
1247569792107675648,1247569792107675648,1586278791000,2020-04-07,23:59:51,+07,3292901241,agingophelia,AgingOphelia,,New Analysis on Need for Emergency Rental Assistance During the COVID-19 and Economic Crisis via @NLIHC https://mailchi.mp/nlihc.org/update_040720 …,['nlihc'],['https://mailchi.mp/nlihc.org/update_040720'],[],0,0,0,[],[],https://twitter.com/AgingOphelia/status/1247569792107675648,False,,0,,,,,,,"[{'user_id': '3292901241', 'username': 'AgingOphelia'}, {'user_id': '41406567', 'username': 'NLIHC'}]",,,,
1247569792099176448,1247569792099176448,1586278791000,2020-04-07,23:59:51,+07,548052152,aldunez,Leo Campos Aldunez,,🙏USEFUL INFORMATION > COVID-19 | Our friends-colleagues at The Business Link have produced a very useful Blog focussing on the Canada Emergency Response Benefit (CERB). || >  https://businesslink.ca/blog/faq-canada-emergency-response-benefit-cerb/ … …,[],['https://businesslink.ca/blog/faq-canada-emergency-response-benefit-cerb/'],[],0,0,0,[],[],https://twitter.com/aldunez/status/1247569792099176448,False,,0,,,,,,,"[{'user_id': '548052152', 'username': 'aldunez'}]",,,,
1247569791264718848,1247569791264718848,1586278791000,2020-04-07,23:59:51,+07,1217628055834963969,okoeze2,OKO EZE,,"Today COVID 19 has again given the government of the day a strategy for the next blame game of why they failed economically.

But in all we live in a state that cares much more of the treasury's benefit other than the people.",[],[],[],0,0,0,[],[],https://twitter.com/OKOEZE2/status/1247569791264718848,False,,0,,,,,,,"[{'user_id': '1217628055834963969', 'username': 'OKOEZE2'}]",,,,
1247569791155671040,1247569791155671040,1586278791000,2020-04-07,23:59:51,+07,63114177,deanfostergloba,Dean Foster,,"We're all in this together. #DanishCulture Quote: ""Many small streams make a large river. #Covid&Culture:  http://ow.ly/Ydj050z6Epn  #beyondthismoment #alonetogether #coronavirus #crosscultural #globaltravel #globalbiz #worldtraveler #globaltraveler #pandemic #globalbusiness pic.twitter.com/4IBS0nA4jg",[],['http://ow.ly/Ydj050z6Epn'],['https://pbs.twimg.com/media/EVBCHPiWoAYbM-8.jpg'],0,0,0,"['#danishculture', '#covid', '#beyondthismoment', '#alonetogether', '#coronavirus', '#crosscultural', '#globaltravel', '#globalbiz', '#worldtraveler', '#globaltraveler', '#pandemic', '#globalbusiness']",[],https://twitter.com/deanfostergloba/status/1247569791155671040,False,,0,,,,,,,"[{'user_id': '63114177', 'username': 'deanfostergloba'}]",,,,
1247569790450819072,1247569790450819072,1586278791000,2020-04-07,23:59:51,+07,26376718,llepen,llepen,,"""The scale of the nightmarish economic and social consequences of the coronavirus are as yet unforeseen. [...] The Eurozone, and perhaps the EU itself, could well be one of Covid-19s victims.""  https://www.telegraph.co.uk/politics/2020/04/03/coronavirus-edging-us-towards-eurozones-collapse/ …",[],['https://www.telegraph.co.uk/politics/2020/04/03/coronavirus-edging-us-towards-eurozones-collapse/'],[],0,1,0,[],[],https://twitter.com/llepen/status/1247569790450819072,False,,0,,,,,,,"[{'user_id': '26376718', 'username': 'llepen'}]",,,,
1247569790144823296,1247569790144823296,1586278791000,2020-04-07,23:59:51,+07,254594651,christinamrau,Christina M Rau 🖋📚🧘‍♀️🚀♍️©️,,"For the love of all that is sacred and all that is @NYGovCuomo, can someone please get the Covid Kiddie Club and their Corona Denying Parents away from my house? #petridishproblems #ThisIsFuckingRidiculous https://twitter.com/christinamrau/status/1245736386260537344 …",['nygovcuomo'],['https://twitter.com/christinamrau/status/1245736386260537344'],[],0,0,2,"['#petridishproblems', '#thisisfuckingridiculous']",[],https://twitter.com/ChristinaMRau/status/1247569790144823296,False,https://twitter.com/ChristinaMRau/status/1245736386260537344,0,,,,,,,"[{'user_id': '254594651', 'username': 'ChristinaMRau'}, {'user_id': '232268199', 'username': 'NYGovCuomo'}]",,,,
1247569789373034502,1247569789373034502,1586278791000,2020-04-07,23:59:51,+07,119781858,wendyphillipspr,Phillips PR,,"‘SURVIVE’ the inspiring anthem by singer-songwriter Reeny Smith was just sent to radio across #NovaScotia. Reeny is donating its airplay proceeds to support #NS’s 42 Hospital Foundations in response to the COVID-19. To donate directly, visit:  http://www.nshealth.ca/donate  pic.twitter.com/WvJKHf9WNa",[],['http://www.nshealth.ca/donate'],['https://pbs.twimg.com/media/EVBBIMwXQAMo-yA.jpg'],0,1,5,"['#novascotia', '#ns']",[],https://twitter.com/wendyphillipspr/status/1247569789373034502,False,,0,,,,,,,"[{'user_id': '119781858', 'username': 'wendyphillipspr'}]",,,,
1247569789326942209,1247569789326942209,1586278791000,2020-04-07,23:59:51,+07,246466701,therealsduffey,The Doc,,"I hope he or nobody else dies of COVID-19, however there is more chance of me voting tory than clapping for one at 8pm tonight 

#getagripyoufuckwits",[],[],[],0,0,0,['#getagripyoufuckwits'],[],https://twitter.com/therealsduffey/status/1247569789326942209,False,,0,,,,,,,"[{'user_id': '246466701', 'username': 'therealsduffey'}]",,,,
1247569788794109952,1247569788794109952,1586278791000,2020-04-07,23:59:51,+07,155409852,__erinbennett,E,,love seeing professors be supportive and flexible for their students experiencing COVID-19 symptoms 🤍  https://twitter.com/LISafterclass/status/1246970405337759746 …,[],['https://twitter.com/LISafterclass/status/1246970405337759746'],[],0,0,0,[],[],https://twitter.com/__erinbennett/status/1247569788794109952,False,https://twitter.com/LISafterclass/status/1246970405337759746,0,,,,,,,"[{'user_id': '155409852', 'username': '__erinbennett'}]",,,,
1247569788324524033,1247553469684178945,1586278790000,2020-04-07,23:59:50,+07,2908132442,vaskop1966,Kanadjanin,,It must be next level hypocrisy critiquing Trudeau’s response to Covid and yet liking tRump’s. But here we are stuck with Canadian deplorable.,"['captivaonmymind', 'ctvnews']",[],[],0,0,0,[],[],https://twitter.com/vaskop1966/status/1247569788324524033,False,,0,,,,,,,"[{'user_id': '2908132442', 'username': 'vaskop1966'}, {'user_id': '2869095345', 'username': 'CaptivaOnMyMind'}, {'user_id': '203123011', 'username': 'CTVNews'}]",,,,
1247569787212804097,1247569787212804097,1586278790000,2020-04-07,23:59:50,+07,1338307681,evaulu05,🇹🇴,,I’m more scared of how I’m gonna pay my medical bills if I get covid-19 than actually getting the virus. The US’s healthcare system is purely centered on profit.,[],[],[],0,0,0,[],[],https://twitter.com/Evaulu05/status/1247569787212804097,False,,0,,,,,,,"[{'user_id': '1338307681', 'username': 'Evaulu05'}]",,,,
1247569785748983809,1247569785748983809,1586278790000,2020-04-07,23:59:50,+07,1144722906070392836,luisliev,Luis Hernandez Lievano,,Help stop the spread of COVID-19. Please read the attached article.  https://www.businesswire.com/news/home/20200407005139/en/Stop-Spread-COVID-19-TrackMyTemp …,[],['https://www.businesswire.com/news/home/20200407005139/en/Stop-Spread-COVID-19-TrackMyTemp'],[],0,0,0,[],[],https://twitter.com/Luisliev/status/1247569785748983809,False,,0,,,,,,,"[{'user_id': '1144722906070392836', 'username': 'Luisliev'}]",,,,
1247569785631543296,1247569785631543296,1586278790000,2020-04-07,23:59:50,+07,29404662,ms_mtrujillo,Mary Queen of Naught ✌️,,Tell Maximus CEO Bruce Caswell to stop putting call center workers in danger during the COVID-19 pandemic. Send a letter:  https://actionnetwork.org/letters/maximuscovid19?source=twitter& …,[],['https://actionnetwork.org/letters/maximuscovid19?source=twitter&'],[],0,0,0,[],[],https://twitter.com/Ms_MTrujillo/status/1247569785631543296,False,,0,,,,,,,"[{'user_id': '29404662', 'username': 'Ms_MTrujillo'}]",,,,
1247569785602236416,1247569785602236416,1586278790000,2020-04-07,23:59:50,+07,28958716,debashissarkar,Debashis Sarkar,,The repercussions of COVID-19 might be so great that the post-coronavirus aviation industry may not be the same again and change market dynamics| #Aviation #Covid_19 | https://simpleflying.com/which-manufacturer-will-come-out-from-coronavirus-on-top/ …,[],['https://simpleflying.com/which-manufacturer-will-come-out-from-coronavirus-on-top/'],[],0,1,0,"['#aviation', '#covid_19']",[],https://twitter.com/DebashisSarkar/status/1247569785602236416,False,,0,,,,,,,"[{'user_id': '28958716', 'username': 'DebashisSarkar'}]",,,,
1247569784629329921,1247561926969659393,1586278790000,2020-04-07,23:59:50,+07,1197571355593641990,deepee60616967,DΣΣPΣΣ,,"It is possible that past exposure to other coronaviruses provides some humoral cross reactivity to COVID-19. This should be closely evaluated...

Ian, will that be an issue for all Ig tests ?","['ianfelipesays', 'scottadamssays']",[],[],1,0,0,[],[],https://twitter.com/deepee60616967/status/1247569784629329921,False,,0,,,,,,,"[{'user_id': '1197571355593641990', 'username': 'deepee60616967'}, {'user_id': '950745060500389888', 'username': 'IanFelipeSays'}, {'user_id': '2853461537', 'username': 'ScottAdamsSays'}]",,,,
1247569783437975554,1247569783437975554,1586278789000,2020-04-07,23:59:49,+07,2596411823,ptmd59,Peter,,technology and nature - a respite from the COVID news  https://twitter.com/refikanadol/status/1247405944532635648 …,[],['https://twitter.com/refikanadol/status/1247405944532635648'],[],1,0,1,[],[],https://twitter.com/PTMD59/status/1247569783437975554,False,https://twitter.com/refikanadol/status/1247405944532635648,0,,,,,,,"[{'user_id': '2596411823', 'username': 'PTMD59'}]",,,,
1247569783048089601,1247569435956662277,1586278789000,2020-04-07,23:59:49,+07,12800392,ukscone,Russell Davis,,all the PCBs. Stock up as you can never have too many PCBs and maybe they'll become the new currency post-covid-19,"['todbot', 'oshpark']",[],[],0,0,2,[],[],https://twitter.com/ukscone/status/1247569783048089601,False,,0,,,,,,,"[{'user_id': '12800392', 'username': 'ukscone'}, {'user_id': '38213', 'username': 'todbot'}, {'user_id': '243342953', 'username': 'oshpark'}]",,,,
1247569782896918528,1247569782896918528,1586278789000,2020-04-07,23:59:49,+07,1521840468,majumderkoyel,Koyel,,"In lieu of the COVID 19 pandemic and rising health crisis in India, this was my attempt to ask some relevant questions.

Your criticism, appreciation and support all are valid, important and required.

#Coronaindia
#covid19india https://youtu.be/rpua38h6nPc ",[],['https://youtu.be/rpua38h6nPc'],[],1,0,0,"['#coronaindia', '#covid19india']",[],https://twitter.com/MajumderKoyel/status/1247569782896918528,False,,0,,,,,,,"[{'user_id': '1521840468', 'username': 'MajumderKoyel'}]",,,,
1247569782238580737,1247569782238580737,1586278789000,2020-04-07,23:59:49,+07,1196695668212953089,gopi_mohanty,Gopi Narayan Mohanty,,"#newprincipalsecrataryinpmo Sir,  BSNL Regular staffs got salary   (32 cr pm)after VRS and other benifit for COVID-19  period .We are 3000 nos of Contract Workers working in  this situation in BSNL did not get Salary for last 7 month  (4 cr per )in Odisha . Kindly Help us.",[],[],[],0,0,0,['#newprincipalsecrataryinpmo'],[],https://twitter.com/gopi_mohanty/status/1247569782238580737,False,,0,,,,,,,"[{'user_id': '1196695668212953089', 'username': 'gopi_mohanty'}]",,,,
1247569781831548929,1247564722007724034,1586278789000,2020-04-07,23:59:49,+07,858325356297584644,bittu_pal1981,IndiaFan,,"Rocket science.. Ohh wow.that means before COVID 19, Indian had employment rate us very high..every family as 2 person employed.",['pti_news'],[],[],0,0,0,[],[],https://twitter.com/Bittu_Pal1981/status/1247569781831548929,False,,0,,,,,,,"[{'user_id': '858325356297584644', 'username': 'Bittu_Pal1981'}, {'user_id': '245687754', 'username': 'PTI_News'}]",,,,
1247569781240274944,1247569781240274944,1586278789000,2020-04-07,23:59:49,+07,1047792604379795456,orthodox_times,Orthodox Times,,"The Patriarchate of Alexandria donated 200,000 Egyptian pounds (approximately € 11,120) to the Tahya Misr Fund
#orthodox_times #COVID #COVID2019 https://orthodoxtimes.com/patriarchate-of-alexandria-donated-200000-egyptian-pounds-against-coronavirus-outbreak/ …",[],['https://orthodoxtimes.com/patriarchate-of-alexandria-donated-200000-egyptian-pounds-against-coronavirus-outbreak/'],[],0,0,4,"['#orthodox_times', '#covid', '#covid2019']",[],https://twitter.com/orthodox_times/status/1247569781240274944,False,,0,,,,,,,"[{'user_id': '1047792604379795456', 'username': 'orthodox_times'}]",,,,
